{
  "v": 1,
  "ts": "2026-02-01T00:00:00.000Z",
  "app": "spectrocap",
  "kind": "intent",
  "id": "__ID__",
  "ref": null,
  "topic": "receiver_config_set",
  "payload": {
    "receiver_ip": "__IP__",
    "receiver_port": 0,
    "receiver_mode": "__MODE__",
    "device": "__DEVICE__"
  },
  "policy": { "plan_ack": true }
}
