{
    "ref":  null,
    "id":  "30beab5c6ece",
    "kind":  "intent",
    "ts":  "2026-02-01T23:44:43.5970842Z",
    "policy":  {
                   "plan_ack":  true
               },
    "v":  1,
    "payload":  {
                    "prompt":  "OP:COMMITPUSH \"Checkpoint: SpectroLINE lane + tooling + OPS hardening (diff/push autofill)\" OP:REMOTE \"origin\" OP:BRANCH \"scpsc-ultra-grade-foundation-clean\""
                },
    "app":  "user",
    "topic":  "chat"
}
