{
    "v":  1,
    "ts":  "2026-02-02T03:06:21.2107151Z",
    "app":  "spectroline-watcher",
    "kind":  "ack",
    "id":  "801c2910c61a-out",
    "ref":  "801c2910c61a",
    "topic":  "clipboard_push_ack",
    "payload":  {
                    "ok":  true,
                    "note":  "ACK by local watcher (lane proof-of-life)",
                    "received_file":  "20260201_235533Z__spectrocap__intent__801c2910c61a.json"
                },
    "policy":  {
                   "plan_ack":  true
               }
}
