{
  "v": 1,
  "ts": "2026-02-01T00:00:00.000Z",
  "app": "spectrocap",
  "kind": "intent",
  "id": "__ID__",
  "ref": null,
  "topic": "file_tx_manifest",
  "payload": {
    "file_name": "__NAME__",
    "bytes": 0,
    "sha256": "__SHA256__",
    "chunks": 1,
    "device": "__DEVICE__"
  },
  "policy": { "plan_ack": true }
}
