{
    "ref":  null,
    "id":  "0ce8057cdc08",
    "kind":  "intent",
    "ts":  "2026-02-01T23:57:20.7031870Z",
    "policy":  {
                   "plan_ack":  true
               },
    "v":  1,
    "payload":  {
                    "prompt":  "OP:COMMITPUSH \"Checkpoint: Test+Verify+Lock\" OP:REMOTE \"origin\" OP:BRANCH \"scpsc-ultra-grade-foundation-clean\""
                },
    "app":  "user",
    "topic":  "chat"
}
