{
    "v":  1,
    "ts":  "2026-02-02T02:06:49.2898490Z",
    "app":  "spectrocap",
    "kind":  "intent",
    "id":  "32e9c052525c",
    "ref":  null,
    "topic":  "clipboard_push",
    "payload":  {
                    "mime":  "text/plain",
                    "content":  "HELLO",
                    "device":  "note20u"
                },
    "policy":  {
                   "plan_ack":  true
               }
}
